{
  "source_version": "shanhai.builtin-generation-source/v1",
  "package": {
    "package_key": "shanhai.primary_math.courseware",
    "name": "小学数学标准课件生产内容包",
    "semantic_version": "1.5.3",
    "runtime_constraint": ">=0.1.0 <1.0.0",
    "change_summary": "在不可变1.5.2基础上前向修正三类九套质量校验对教师适配说明中讲授边界复述的误判；旧Release与既有项目绑定保持不变。"
  },
  "styles": [
    {
      "preset_key": "style.primary_math.paper_clay",
      "title": "纸艺黏土数学世界",
      "description": "用于小学数学课件的清晰纸艺与轻黏土视觉语言，正文保持纯白画布。",
      "modalities": ["image", "video", "presentation"],
      "visual_language": "真实纸张层次与轻黏土物件结合，造型清楚、尺度稳定、接触关系可信，儿童友好但不过度卡通化。",
      "palette": ["清澈蓝绿", "明亮柠檬黄", "珊瑚红强调", "纯白正文画布"],
      "mood": ["明快", "有秩序", "可信", "适合课堂投影"],
      "texture": ["细腻哑光纸感", "轻黏土柔和体积", "克制接触阴影"],
      "negative_constraints": [
        "禁止水印、Logo和乱码",
        "禁止把准确文字、数字、公式或答案烘焙进图片",
        "禁止廉价贴纸堆叠和无关装饰",
        "禁止恐怖、成人化和危险模仿内容"
      ],
      "extensions": {
        "image": {
          "medium": "paper craft and soft clay digital illustration",
          "composition_preferences": ["单一视觉焦点", "明确前中后层次", "保留可编辑教学信息区域"],
          "lighting": ["明亮柔和主光", "低戏剧性阴影", "主体接触面清楚"]
        },
        "video": {
          "motion_language": "单镜头一个主要可见节拍，动作连续且首尾状态清楚",
          "camera_language": "稳定机位配合一次主要运镜，避免无目的摇晃和突变",
          "pacing": "适合低年级观看，变化可辨识但不拖慢",
          "transition_style": "以动作衔接和状态连续为主，少用炫技转场"
        },
        "presentation": {
          "background_policy": "white",
          "typography": "清晰无衬线中文字体；文字、数字和数学符号保持PPT原生可编辑",
          "layout_density": "sparse",
          "illustration_style": "封面允许完整主视觉，正文只使用与封面同视觉语言的独立场景或物件资产"
        }
      }
    }
  ],
  "deterministic_outputs": [
    {
      "output_key": "ppt.pages.assemble.output",
      "title": "PPT页面装配输出",
      "description": "锁定逐页规格、每页唯一背景版本和可编辑元素的确定性装配事实。",
      "definition_role": "artifact",
      "fields": [
        {"field_key": "implementation_version", "label": "装配实现版本", "type": "text", "required": true, "editable": false, "deletable": false},
        {"field_key": "content_hash", "label": "装配内容哈希", "type": "text", "required": true, "editable": false, "deletable": false},
        {"field_key": "source_page_spec_version_id", "label": "页面规格版本", "type": "reference", "required": true, "editable": false, "deletable": false},
        {"field_key": "source_page_spec_set_key", "label": "页面规格集标识", "type": "text", "required": true, "editable": false, "deletable": false},
        {"field_key": "page_count", "label": "页数", "type": "number", "required": true, "editable": false, "deletable": false, "validation_rules": [{"equals_repeatable_count": "pages"}]},
        {
          "field_key": "pages",
          "label": "页面装配事实",
          "type": "list",
          "required": true,
          "editable": false,
          "deletable": false,
          "min_items": 1,
          "max_items": 60,
          "children": [
            {"field_key": "page_key", "label": "页面标识", "type": "text", "required": true, "editable": false, "deletable": false},
            {"field_key": "position", "label": "页序", "type": "number", "required": true, "editable": false, "deletable": false},
            {"field_key": "background_file_asset_version_id", "label": "背景文件版本", "type": "reference", "required": true, "editable": false, "deletable": false},
            {"field_key": "background_sha256", "label": "背景哈希", "type": "text", "required": true, "editable": false, "deletable": false},
            {"field_key": "background_media_type", "label": "背景MIME", "type": "text", "required": true, "editable": false, "deletable": false},
            {"field_key": "background_size_bytes", "label": "背景字节数", "type": "number", "required": true, "editable": false, "deletable": false},
            {"field_key": "background_width", "label": "背景宽度", "type": "number", "required": true, "editable": false, "deletable": false},
            {"field_key": "background_height", "label": "背景高度", "type": "number", "required": true, "editable": false, "deletable": false},
            {"field_key": "elements", "label": "可编辑元素", "type": "list", "required": true, "editable": false, "deletable": false}
          ]
        }
      ]
    },
    {
      "output_key": "pptx.export.output",
      "title": "可编辑PPTX导出输出",
      "description": "绑定确定性装配、真实PPTX文件版本和完整性事实的不可变输出。",
      "definition_role": "artifact",
      "fields": [
        {"field_key": "implementation_version", "label": "导出实现版本", "type": "text", "required": true, "editable": false, "deletable": false},
        {"field_key": "assembly_artifact_version_id", "label": "装配Artifact版本", "type": "reference", "required": true, "editable": false, "deletable": false},
        {"field_key": "source_page_spec_version_id", "label": "页面规格版本", "type": "reference", "required": true, "editable": false, "deletable": false},
        {"field_key": "file_asset_version_id", "label": "PPTX文件版本", "type": "reference", "required": true, "editable": false, "deletable": false},
        {"field_key": "mime_type", "label": "PPTX MIME", "type": "text", "required": true, "editable": false, "deletable": false},
        {"field_key": "size_bytes", "label": "PPTX字节数", "type": "number", "required": true, "editable": false, "deletable": false},
        {"field_key": "sha256", "label": "PPTX哈希", "type": "text", "required": true, "editable": false, "deletable": false},
        {"field_key": "page_count", "label": "页数", "type": "number", "required": true, "editable": false, "deletable": false},
        {"field_key": "background_file_asset_version_ids", "label": "背景文件版本集合", "type": "list", "required": true, "editable": false, "deletable": false, "min_items": 1, "max_items": 60}
      ]
    }
  ],
  "artifacts": [
    {
      "definition_key": "material.scope_review.output",
      "title": "教材范围确认",
      "description": "教师确认的exact教材页段、证据键、知识边界与课时划分约束。",
      "fields": [
        {"field_key": "source_material_id", "label": "教材身份", "type": "reference", "required": true, "editable": false, "deletable": false, "visibility": "hidden"},
        {"field_key": "material_parse_version_id", "label": "教材解析版本", "type": "reference", "required": true, "editable": false, "deletable": false, "visibility": "hidden"},
        {"field_key": "knowledge_point", "label": "知识点", "type": "text", "required": true, "editable": true, "deletable": false, "visibility": "primary", "validation_rules": [{"min_length": 1}, {"max_length": 255}]},
        {"field_key": "knowledge_boundary", "label": "知识边界", "type": "object", "required": true, "editable": true, "deletable": false, "visibility": "primary", "children": [
          {"field_key": "allowed", "label": "允许内容", "type": "list", "required": true, "editable": true, "deletable": false, "min_items": 1},
          {"field_key": "forbidden", "label": "禁止超前内容", "type": "list", "required": true, "editable": true, "deletable": false, "min_items": 1}
        ]},
        {"field_key": "approved_evidence_keys", "label": "批准证据键", "type": "list", "required": true, "editable": true, "deletable": false, "min_items": 1},
        {"field_key": "page_start", "label": "起始物理页", "type": "number", "required": true, "editable": false, "deletable": false, "validation_rules": [{"minimum": 1}]},
        {"field_key": "page_end", "label": "结束物理页", "type": "number", "required": true, "editable": false, "deletable": false, "validation_rules": [{"minimum": 1}]},
        {"field_key": "duration_minutes", "label": "每课时分钟数", "type": "number", "required": true, "editable": true, "deletable": false, "validation_rules": [{"minimum": 30}, {"maximum": 60}]},
        {"field_key": "lesson_count_mode", "label": "课时数量模式", "type": "enum", "required": true, "editable": true, "deletable": false, "options": [{"value": "auto", "label": "自动划分"}, {"value": "specified", "label": "指定数量"}]},
        {"field_key": "requested_lesson_count", "label": "指定课时数", "type": "number", "required": false, "editable": true, "deletable": false, "validation_rules": [{"minimum": 1}, {"maximum": 20}]},
        {"field_key": "lesson_type_preferences", "label": "课型偏好", "type": "list", "required": false, "editable": true, "deletable": false},
        {"field_key": "special_requirements", "label": "特殊要求", "type": "rich_text", "required": false, "editable": true, "deletable": false, "validation_rules": [{"max_length": 4000}]}
      ]
    }
  ],
  "nodes": [
    {
      "template_key": "lesson.division.generate",
      "title": "课时划分生成",
      "description": "从教师批准的教材范围中划分可独立实施的40分钟课时，只决定课时边界，不同时生成详细教案。",
      "model_capability": "text.structured.zh_primary_math",
      "input": {
        "description": "教师可调整课时长度、课时数策略和特殊约束；教材内容只从批准的解析快照注入。",
        "fields": [
          {
            "field_key": "duration_minutes",
            "label": "每课时分钟数",
            "description": "默认按小学数学40分钟课堂设计。",
            "value_type": "number",
            "required": true,
            "source": "teacher",
            "visibility": "primary",
            "widget": "number",
            "default_value": 40,
            "validation": {"minimum": 30, "maximum": 60}
          },
          {
            "field_key": "lesson_count_mode",
            "label": "课时数量",
            "value_type": "enum",
            "required": true,
            "source": "teacher",
            "visibility": "primary",
            "widget": "select",
            "default_value": "auto",
            "options": [
              {"value": "auto", "label": "自动划分"},
              {"value": "specified", "label": "指定数量"}
            ]
          },
          {
            "field_key": "requested_lesson_count",
            "label": "指定课时数",
            "description": "仅在指定数量时使用；模型仍须报告容量或知识边界冲突。",
            "value_type": "number",
            "required": false,
            "source": "teacher",
            "visibility": "secondary",
            "widget": "number",
            "validation": {"minimum": 1, "maximum": 20}
          },
          {
            "field_key": "lesson_type_preferences",